product_code,name_ko,name_en,name_ru,barcode,brand,volume,pcs_per_carton,width_cm,height_cm,depth_cm,cbm,weight_kg,hscode,status
VMBA001,"밸르모나 얼쓰 리페어 본딩 앰플 15ml * 6ea","VALMONA Earth Repair Bonding Ampoule 15ml * 6ea","[VALMONA] НАБОР Сыворотка для волос ВОССТАНОВЛЕНИЕ Earth Repair Bonding Ampoule, 6 шт * 15 мл",8802929006109,VALMONA,,30,,,,,,,active
VMCP001,"밸르모나 얼쓰 리페어 본딩 컴파운드 40ml","VALMONA Earth Repair Bonding Compound 40ml","[VALMONA] Маска для волос Earth Repair Bonding Compound, 40 мл",8802929006123,VALMONA,,110,,,,,,,active
VMOL001,"밸르모나 얼쓰 리페어 본딩 오일 30ml","VALMONA EARTH REPAIR BONDING OIL 30ml","[VALMONA] Масло для волос ВОССТАНОВЛЕНИЕ Earth Repair Bonding Oil, 30 мл",8802929006284,VALMONA,,96,,,,,,,active
VMRS004,"밸르모나 아유르베딕 두피 솔루션 블랙 커민 컨디셔너 480ml","VALMONA Ayurvedic Repair Solution Black Cumin Nutrient Conditioner","[VALMONA] Кондиционер для волос АЮРВЕДА Ayurvedic Repair Solution Black Cumin Nutrient Conditioner, 480 мл",8802929002941,VALMONA,,20,20.00,11.00,12.00,0.023800,,3305.90-1000,active
VMRS005,"밸르모나 서리태 컨디셔너","VALMONA Powerful Solution Black Peony Seoritae Nutrient Conditioner","[VALMONA] Кондиционер ЧЕРНЫЙ ПИОН/БОБЫ Black Peony Seoritae Nutrient Conditioner, 480 мл",8802929003795,VALMONA,,20,20.00,11.00,12.00,0.023800,,3305.90-1000,active
VMRS007,"밸르모나 비듬 두피 솔루션 슈가벨벳 컨디셔너","VALMONA Sugar Velvet Milk Nutrient Conditioner","[VALMONA] Кондиционер ЯГОДЫ Sugar Velvet Milk Nutrient Conditioner, 480 мл",8802929003924,VALMONA,,20,20.00,11.00,12.00,0.023800,,3305.90-1000,active
VMRS008,"밸르모나 요크마요 영양팩 480ml","VALMONA Yolk Mayo Nutrient Conditioner","[VALMONA] Кондиционер для волос ПИТАНИЕ Nourishing Solution Yolk-Mayo Nutrient Conditioner, 480 мл",8802929004464,VALMONA,,20,20.00,11.00,12.00,0.023800,,3305.90-1000,active
VMRS009,"밸르모나 블루클리닉 컨디셔너 480ml","VALMONA Blue Clinic Nutrient Conditioner","[VALMONA] Кондиционер для волос УВЛАЖНЕНИЕ Recharge Solution Blue Clinic Nutrient Conditioner,480 мл",8802929004433,VALMONA,,20,20.00,11.00,12.00,0.023800,,3305.90-1000,active
VMRSM04,"밸르모나 아유르베딕 두피 솔루션 블랙 커민 컨디셔너 100ml","VALMONA Ayurvedic Repair Solution Black Cumin Nutrient Conditioner 100ml","[VALMONA] Кондиционер для волос АЮРВЕДА Ayurvedic Repair Solution Black Cumin Nutrient Conditioner, 100 мл",8802929004372,VALMONA,,80,80.00,9.50,10.50,0.035900,,3305.90-1000,active
VMRSM05,"밸르모나 서리태 컨디셔너 100ml","VALMONA Powerful Solution Black Peony Seoritae Nutrient Conditioner 100ml","[VALMONA] Кондиционер ЧЕРНЫЙ ПИОН/БОБЫ Black Peony Seoritae Nutrient Conditioner, 480 мл",8802929004334,VALMONA,,80,80.00,9.50,10.50,0.035900,,3305.90-1000,active
VMRSM07,"밸르모나 비듬 두피 솔루션 슈가벨벳 컨디셔너 100ml","VALMONA Sugar Velvet Milk Nutrient Conditioner 100ml","[VALMONA] Кондиционер ЯГОДЫ Sugar Velvet Milk Nutrient Conditioner,100 мл",8802929004358,VALMONA,,80,80.00,9.50,10.50,0.035900,,3305.90-1000,active
VMRSM08,"밸르모나 요크마요 영양팩 100ml","VALMONA Yolk Mayo Nutrient Conditioner 100ml","[VALMONA] Кондиционер для волос ПИТАНИЕ Nourishing Solution Yolk-Mayo Nutrient Conditioner, 100 мл",8802929004518,VALMONA,,80,80.00,9.50,10.50,0.035900,,3305.90-1000,active
VMRSM09,"밸르모나 블루클리닉 컨디셔너 100ml","VALMONA Blue Clinic Nutrient Conditioner 100ml","[VALMONA] Кондиционер для волос УВЛАЖНЕНИЕ Recharge Solution Blue Clinic Nutrient Conditioner,100 мл",8802929004501,VALMONA,,80,80.00,9.50,10.50,0.035900,,3305.90-1000,active
VMRSP04,"밸르모나 아유르베딕 두피 솔루션 블랙 커민 컨디셔너 파우치 10ml","Valmona Ayurvedic Scalp Solution Black Cumin Nutrient Conditioner POUCH 10ml",,"(파우치)8802929005096
 (단상자)8802929005201",VALMONA,,500,,,,,,,active
VMRSP05,"밸르모나 서리태 컨디셔너 파우치 10ml","VALMONA Powerful Solution Black Peony Seoritae Nutrient Conditioner  POUCH 10ml",,"(파우치)8802929005058
 (단상자)8802929005164",VALMONA,,500,,,,,,,active
VMRSP07,"밸르모나 비듬 두피 솔루션 슈가벨벳 컨디셔너 
 파우치 10ml","VALMONA Sugar Velvet Milk Conditioner  POUCH 10ml",,"(파우치)8802929005102
 (단상자)8802929005188",VALMONA,,500,,,,,,,active
VMRSP08,"밸르모나 요크마요 영양팩 파우치 10ml","VALMONA Yolk Mayo Nutrient Conditioner POUCH 10ml",,"(파우치)8802929005140
 (단상자)8802929005249",VALMONA,,500,,,,,,,active
VMRSP09,"밸르모나 블루클리닉 컨디셔너 파우치 10ml","VALMONA Blue Clinic Nutrient Conditioner POUCH 10ml",,"(파우치)8802929005126
 (단상자)8802929005225",VALMONA,,500,,,,,,,active
VMSF001,"밸르모나 얼쓰 테라피 스칼프 퓨리파이어 25ml","VALMONA Earth Therapy Scalp Purifier 25ml","[VALMONA] Сыворотка для кожи головы УСПОКАИВАЮЩАЯ Earth Therapy Scalp Purifier, 25 мл",8802929006062,VALMONA,,100,,,,,,,active
VMSF3T1,"밸르모나 얼쓰 테라피 스칼프 퓨리파이어 25ml * 3ea","VALMONA Earth Therapy Scalp Purifier 25ml * 3ea","[VALMONA] НАБОР Сыворотка для кожи головы УСПОКАИВАЮЩАЯ Earth Therapy Scalp Purifier, 3 шт * 25 мл",8802929006079,VALMONA,,100,,,,,,,active
VMSP004,"밸르모나 아유르베딕 두피 솔루션 블랙 커민 샴푸액 (Black Cumin Shampoo) 480ml","Valmona Ayurvedic Scalp Solution Black Cumin Shampoo","[VALMONA] Шампунь для волос АЮРВЕДА Ayurvedic Scalp Solution Black Cumin Shampoo, 480 мл",8802929883205,VALMONA,,20,20.00,11.00,12.00,0.023800,,3305.10-0000,active
VMSP005,"밸르모나 서리태 샴푸","VALMONA Powerful Solution Black Peony Seoritae Shampoo","[VALMONA] Шампунь для волос ЧЕРНЫЙ ПИОН/БОБЫ Powerful Solution Black Peony Seoritae Shampoo, 480 мл",8802929003788,VALMONA,,20,20.00,11.00,12.00,0.023800,,3305.10-0000,active
VMSP006,"밸르모나 진생 헤리티지 고삼 샴푸 300ml","VALMONA Ginseng Heritage Gosam Shampoo","[VALMONA] Шампунь для волос ЗАЩИТА / УКРЕПЛЕНИЕ Ginseng Heritage Gosam Shampoo, 300 мл",8802929007427,VALMONA,,30,30.00,10.30,11.30,0.021840,,3305.10-0000,active
VMSP007,"밸르모나 비듬 두피 솔루션 슈가벨벳 샴푸","VALMONA Sugar Velvet Milk Shampoo","[VALMONA] Шампунь для волос ЯГОДЫ Sugar Velvet Milk Shampoo, 480 мл",8802929003931,VALMONA,,20,20.00,11.00,12.00,0.023800,,3305.10-0000,active
VMSP008,"밸르모나 요크마요 샴푸 480ml","VALMONA Yolk Mayo Shampoo","[VALMONA] Шампунь для волос ПИТАНИЕ Nourishing Solution Yolk-Mayo Shampoo, 480 мл",8802929004440,VALMONA,,20,20.00,11.00,12.00,0.023800,,3305.10-0000,active
VMSP009,"밸르모나 블루클리닉 샴푸 480ml","VALMONA Blue Clinic Shampoo","[VALMONA] Шампунь для волос УВЛАЖНЕНИЕ Recharge Solution Blue Clinic Shampoo, 480 мл",8802929004457,VALMONA,,20,20.00,11.00,12.00,0.023800,,3305.10-0000,active
VMSP013,"밸르모나 얼쓰 바이탈 샴푸 500ml","VALMONA Earth Vital Shampoo 500ml","[VALMONA] Earth Vital Shampoo 500ml",8802929009414,VALMONA,,30,20.00,11.00,12.00,0.030360,,3305.10-0000,active
VMSPM07,"밸르모나 비듬 두피 솔루션 슈가벨벳 샴푸 100ml","VALMONA Sugar Velvet Milk Shampoo 100ml","[VALMONA] Шампунь для волос ЯГОДЫ Sugar Velvet Milk Shampoo, 100 мл",8802929004341,VALMONA,,80,80.00,9.50,10.50,0.035900,,3305.10-0000,active
VMSPM08,"밸르모나 요크마요 샴푸 100ml","VALMONA Yolk Mayo Shampoo 100ml","[VALMONA] Шампунь для волос ПИТАНИЕ Nourishing Solution Yolk-Mayo Shampoo, 100 мл",8802929004495,VALMONA,,80,80.00,9.50,10.50,0.035900,,3305.10-0000,active
VMSPM09,"밸르모나 블루클리닉 샴푸 100ml","VALMONA Blue Clinic Shampoo 100ml","[VALMONA] Шампунь для волос УВЛАЖНЕНИЕ Recharge Solution Blue Clinic Shampoo, 100 мл",8802929004488,VALMONA,,80,80.00,9.50,10.50,0.035900,,3305.10-0000,active
VMSPMR4,"밸르모나 아유르베딕 두피 솔루션 블랙 커민 샴푸액 (Black Cumin Shampoo) 100ml","Valmona Ayurvedic Scalp Solution Black Cumin Shampoo 100ml","[VALMONA] Шампунь для волос АЮРВЕДА Ayurvedic Scalp Solution Black Cumin Shampoo, 100 мл",8802929004365,VALMONA,,80,80.00,9.50,10.50,0.035900,,3305.10-0000,active
VMSPMR5,"밸르모나 서리태 샴푸 100ml","VALMONA Powerful Solution Black Peony Seoritae Shampoo 100ml","[VALMONA] Шампунь для волос ЧЕРНЫЙ ПИОН/БОБЫ Powerful Solution Black Peony Seoritae Shampoo, 100 мл",8802929004327,VALMONA,,80,80.00,9.50,10.50,0.035900,,3305.10-0000,active
VMSPP04,"밸르모나 아유르베딕 두피 솔루션 블랙 커민 샴푸 파우치 10ml","Valmona Ayurvedic Scalp Solution Black Cumin Shampoo  POUCH 10ml",,"(파우치)8802929005089
 (단상자)8802929005195",VALMONA,,500,,,,,,,active
VMSPP05,"밸르모나 서리태 샴푸 파우치 10ml","VALMONA Powerful Solution Black Peony Seoritae Shampoo  POUCH 10ml",,"(파우치)8802929005041
 (단상자)8802929005157",VALMONA,,500,,,,,,,active
VMSPP07,"밸르모나 비듬 두피 솔루션 슈가벨벳 샴푸 파우치 10ml","VALMONA Sugar Velvet Milk Shampoo  POUCH 10ml",,"(파우치)8802929005065
 (단상자)8802929005171",VALMONA,,500,,,,,,,active
VMSPP08,"밸르모나 요크마요 샴푸 파우치 10ml","VALMONA Yolk Mayo Shampoo POUCH 10ml",,"(파우치)8802929005133
 (단상자)8802929005232",VALMONA,,500,,,,,,,active
VMSPP09,"밸르모나 블루클리닉 샴푸 파우치 10ml","VALMONA Blue Clinic Shampoo POUCH 10ml",,"(파우치)8802929005119
 (단상자)8802929005218",VALMONA,,500,,,,,,,active
VMSS001,"밸르모나 얼쓰 테라피 스칼프 스켈러 15ml * 6ea","VALMONA Earth Therapy Scalp Scaler 15ml * 6ea","[VALMONA] НАБОР Сыворотка для кожи головы ОЧИЩАЮЩАЯ Earth Therapy Scalp Scaler, 6 шт * 15 мл",8802929006093,VALMONA,,30,,,,,,,active
WMCR004,"위드미 판테스틱 더마 시카 크림 100ml","WITHME Panthestic Derma Cica Cream",,8802929003429,PANTHESTIC,,60,,,,,,,active
WMPK001,"위드미 어썸 블랙 포어 클리어팩 30g","WITHME Awesome Black Pore Clear Pack",,8802929002422,WITHME,,168,,,,,,,active
WMTN001,"위드미 스노우 화이트닝 포어 토너 500ml","WITHME Snow Whitening Pore Toner",,8802929003023,WITHME,,24,,,,,,,active