product_code,name_ko,name_en,name_ru,barcode,brand,volume,pcs_per_carton,width_cm,height_cm,depth_cm,cbm,weight_kg,hscode,status
KBHC003,"키스바이 로즈마인 핸드크림 엔젤스 하트","Kiss by Rosemine Fragrance Hand Cream Angel's Heart","[Kiss by Rosemine] Крем для рук АРОМАТ ""СЕРДЦЕ АНГЕЛА"" Kiss by Rosemine Fragrance Hand Cream Angel's Heart, 60 мл",8802929004181,ROSEMINE,,100,100.00,7.60,8.60,0.026360,,3304.99-1000,active
KBHC004,"키스바이 로즈마인 핸드크림 엔젤스 로즈","Kiss by Rosemine Fragrance Hand Cream Angel's Rose","[Kiss by Rosemine] Крем для рук АРОМАТ ""АНГЕЛЬСКАЯ РОЗА"" Kiss by Rosemine Fragrance Hand Cream Angel's Rose, 60 мл",8802929004198,ROSEMINE,,100,100.00,7.60,8.60,0.026360,,3304.99-1000,active
KBHC005,"키스바이 로즈마인 핸드크림 엔젤스 러브","Kiss by Rosemine Fragrance Hand Cream Angel's Love","[Kiss by Rosemine] Крем для рук АРОМАТ ""ЛЮБОВЬ АНГЕЛА"" Kiss by Rosemine Fragrance Hand Cream Angel's Love, 60 мл",8802929004204,ROSEMINE,,100,100.00,7.60,8.60,0.026360,,3304.99-1000,active
KBHC006,"키스바이 로즈마인 프래그런스 핸드크림- 글래머 센슈얼리티","Kiss by Rosemine Fragrance Hand Cream-Glamour Sensuality 30ml","[Kiss by Rosemine] Крем для рук ДРЕВЕСНО-МУСКУСНЫЙ АРОМАТ Fragrance Hand Cream - Glamour Sensuality, 30 мл",8802929006819,ROSEMINE,,400,400.00,14.40,15.40,0.023800,,3304.99-1000,active
KBHC007,"키스바이 로즈마인 프래그런스 핸드크림- 글래머 판타지","Kiss by Rosemine Fragrance Hand Cream-Glamour Fantasy 30ml","[Kiss by Rosemine] Крем для рук АРОМАТ СПЕЛЫХ ФРУКТОВ Fragrance Hand Cream - Glamour Fantasy, 30 мл",8802929006826,ROSEMINE,,400,400.00,14.40,15.40,0.023800,,3304.99-1000,active
KBHC008,"키스바이 로즈마인 프래그런스 핸드크림- 글래머 프레셔스","Kiss by Rosemine Fragrance Hand Cream-Glamour Precious 30ml","[Kiss by Rosemine] Крем для рук МАНДАРИН/СЛАДКИЙ ЖАСМИН Fragrance Hand Cream - Glamour Precious, 30 мл",8802929006833,ROSEMINE,,400,400.00,14.40,15.40,0.023800,,3304.99-1000,active
KBHC009,"키스바이 로즈마인 프래그런스 핸드크림- 오,프레쉬 포에버","Kiss by Rosemine Fragrance Hand Cream-Oh, Fresh Forever 30ml","[Kiss by Rosemine] Крем для рук ЦВЕТОЧНЫЙ АРОМАТ ИРИСА Fragrance Hand Cream - Oh, Fresh Forever, 30 мл",8802929006840,ROSEMINE,,400,400.00,14.40,15.40,0.023800,,3304.99-1000,active
KBHC010,"키스바이 로즈마인 프래그런스 핸드크림- 오,프레쉬 허브가든","Kiss by Rosemine Fragrance Hand Cream-Oh, Fresh Herb Garden 30ml","[Kiss by Rosemine] Крем для рук СВЕЖИЙ ТРАВЯНОЙ АРОМАТ Fragrance Hand Cream - Oh, Fresh Herb Garden, 30 мл",8802929006857,ROSEMINE,,400,400.00,14.40,15.40,0.023800,,3304.99-1000,active
KBHC011,"키스바이 로즈마인 프래그런스 핸드크림- 글래머 대즐링","Kiss by rosemine fragrance hand cream 30ml  Glamour Dazzling","[Kiss by Rosemine] Крем для рук ЦВЕТОЧНО-ФРУКТОВЫЙ АРОМАТ ИЛАНГ-ИЛАНГ / ЯБЛОКО Fragrance hand cream - Glamour Dazzling, 30 мл",8802929009674,ROSEMINE,,400,400.00,14.40,15.40,0.023800,,3304.99-1000,active
KBHC012,"키스바이 로즈마인 프래그런스 핸드크림- 글래머 멜로우","Kiss by rosemine fragrance hand cream 30ml  Glamour Mellow","[Kiss by Rosemine] Крем для рук ДРЕВЕСНО-ЦИТРУСОВЫЙ АРОМАТ Fragrance hand cream - Glamour Mellow, 30 мл",8802929009681,ROSEMINE,,400,400.00,14.40,15.40,0.023800,,3304.99-1000,active
KBHC013,"키스바이 로즈마인 프래그런스 핸드크림- 글래머 캔디블룸","Kiss by rosemine fragrance hand cream 30ml  Glamour Candy Bloom","[Kiss by Rosemine] Крем для рук КАРАМЕЛЬНО-ЦВЕТОЧНЫЙ АРОМАТ Fragrance hand cream Glamour Candy Bloom, 30 мл",8802929009698,ROSEMINE,,400,400.00,14.40,15.40,0.023800,,3304.99-1000,active
KBOW001,"키스바이 로즈마인 프래그런스 오일워시 글래머 센슈얼리티","Kiss by Rosemine Fragrance Oil Wash-Glamour Sensuality","[Kiss by Rosemine] Гель для душа ДРЕВЕСНО-МУСКУСНЫЙ АРОМАТ Fragrance Oil Wash - Glamour Sensuality, 300 мл",8802929007311,ROSEMINE,,30,30.00,10.60,11.60,0.021300,,3401.30-0000,active
KBOW002,"키스바이 로즈마인 프래그런스 오일워시 글래머 판타지","Kiss by Rosemine Fragrance Oil Wash-Glamour Fantasy","[Kiss by Rosemine] Гель для душа АРОМАТ СПЕЛЫХ ФРУКТОВ Fragrance Oil Wash - Glamour Fantasy, 300 мл",8802929007328,ROSEMINE,,30,30.00,10.60,11.60,0.021300,,3401.30-0000,active
KBOW003,"키스바이 로즈마인 프래그런스 오일워시 글래머 프레셔스","Kiss by Rosemine Fragrance Oil Wash-Glamour Precious","[Kiss by Rosemine] Гель для душа МАНДАРИН/СЛАДКИЙ ЖАСМИН Fragrance Oil Wash - Glamour Precious, 300 мл",8802929007335,ROSEMINE,,30,30.00,10.60,11.60,0.021300,,3401.30-0000,active
KBOW004,"키스바이 로즈마인 프래그런스 오일워시 오 프레쉬 포에버","Kiss by Rosemine Fragrance Oil Wash-Oh, Fresh Forever","[Kiss by Rosemine] Гель для душа ЦВЕТОЧНЫЙ АРОМАТ ИРИСА Fragrance Oil Wash - Oh, Fresh Forever, 300 мл",8802929007342,ROSEMINE,,30,30.00,10.60,11.60,0.021300,,3401.30-0000,active
KBOW005,"키스바이 로즈마인 프래그런스 오일워시 오 프레쉬 허브가든","Kiss by Rosemine Fragrance Oil Wash-Oh, Fresh Herb Garden","[Kiss by Rosemine] Гель для душа СВЕЖИЙ ТРАВЯНОЙ АРОМАТ Fragrance Oil Wash - Oh, Fresh Herb Garden, 300 мл",8802929007359,ROSEMINE,,30,30.00,10.60,11.60,0.021300,,3401.30-0000,active
NPBC001,"나뚜리아 퓨어 바디워시 750ml_크랜베리 앤 오렌지","NATURIA PURE BODY WASH (Cranberry & Orange)","[NATURIA] Гель для душа КЛЮКВА/АПЕЛЬСИН Pure Body Wash (Cranberry & Orange), 750 мл",8802929996677,NATURIA,,24,24.00,20.40,21.40,0.041620,,3401.30-0000,active
NPBC002,"나뚜리아 퓨어 바디워시 750ml_와일드 민트 앤 라임","NATURIA PURE BODY WASH (Wild Mint & Lime)","[NATURIA] Гель для душа МЯТА/ЛАЙМ Pure Body Wash (Wild Mint & Lime), 750 мл",8802929996684,NATURIA,,24,24.00,20.40,21.40,0.041620,,3401.30-0000,active
NPBC003,"나뚜리아 퓨어 바디워시 750ml_로즈 앤 로즈마리","NATURIA PURE BODY WASH (Rose & Rosemary)","[NATURIA] Гель для душа РОЗА/РОЗМАРИН Pure Body Wash (Rose & Rosemary), 750 мл",8802929996691,NATURIA,,24,24.00,20.40,21.40,0.041620,,3401.30-0000,active
NPBC004,"나뚜리아 퓨어 바디워시 750ml_허니 앤 화이트 릴리","NATURIA PURE BODY WASH (Honey & White Lily)","[NATURIA] Гель для душа МЕД/ЛИЛИЯ Pure Body Wash (Honey & White Lily), 750 мл",8802929996707,NATURIA,,24,24.00,20.40,21.40,0.041620,,3401.30-0000,active
NPBC005,"나뚜리아 크리미 밀크 바디워시 750ml- 밀크미","NATURIA  CREAMY MILK BODY WASH  MILK ME","[NATURIA] Гель для душа МОЛОЧНЫЙ Creamy Milk Body Wash - Milk me, 750 мл",8802929005638,NATURIA,,24,24.00,20.40,21.40,0.041620,,3401.30-0000,active
NPBC006,"나뚜리아 크리미 밀크 바디워시 750ml- 쏘바닐라","NATURIA  CREAMY MILK BODY WASH  SO VANILLA","[NATURIA] Гель для душа ВАНИЛЬ Creamy Milk Body Wash - So vanilla, 750 мл",8802929005645,NATURIA,,24,24.00,20.40,21.40,0.041620,,3401.30-0000,active
NPBC007,"나뚜리아 크리미 밀크 바디워시 750ml- 초코라떼","NATURIA  CREAMY MILK BODY WASH  CHOCO LATTE","[NATURIA] Гель для душа ШОКОЛАД Creamy Milk Body Wash - Choco latte, 750 мл",8802929005652,NATURIA,,24,24.00,20.40,21.40,0.041620,,3401.30-0000,active
NPBC008,"나뚜리아 크리미 밀크 바디워시 750ml- 그린티","NATURIA  CREAMY MILK BODY WASH  GREEN TEA","[NATURIA] Гель для душа ЗЕЛЕНЫЙ ЧАЙ Creamy Milk Body Wash - Green tea, 750 мл",8802929005669,NATURIA,,24,24.00,20.40,21.40,0.041620,,3401.30-0000,active
NPBC009,"나뚜리아 크리미 밀크 바디워시 750ml- 무화과","NATURIA  CREAMY MILK BODY WASH  FIG PULP","[NATURIA] Гель для душа ИНЖИР Creamy Milk Body Wash - Fig Pulp, 750 мл",8802929006413,NATURIA,,24,24.00,20.40,21.40,0.041620,,3401.30-0000,active
NPBCT01,"나뚜리아 퓨어 바디워시 100ml_크랜베리 앤 오렌지","NATURIA PURE BODY WASH 100ml  (Cranberry & Orange)","[NATURIA] Гель для душа КЛЮКВА/АПЕЛЬСИН Pure Body Wash (Cranberry & Orange), 100 мл",8802929004921,NATURIA,,80,,,,,,,active
NPBCT02,"나뚜리아 퓨어 바디워시 100ml_와일드 민트 앤 라임","NATURIA PURE BODY WASH 100ml (Wild Mint & Lime)","[NATURIA] Гель для душа МЯТА/ЛАЙМ Pure Body Wash (Wild Mint & Lime), 100 мл",8802929004938,NATURIA,,80,,,,,,,active
NPBCT03,"나뚜리아 퓨어 바디워시 100ml_로즈 앤 로즈마리","NATURIA PURE BODY WASH 100ml (Rose & Rosemary)","[NATURIA] Гель для душа РОЗА/РОЗМАРИН Pure Body Wash (Rose & Rosemary), 100 мл",8802929004945,NATURIA,,80,,,,,,,active
NPBCT04,"나뚜리아 퓨어 바디워시 100ml_허니 앤 화이트 릴리","NATURIA PURE BODY WASH 100ml (Honey & White Lily)","[NATURIA] Гель для душа МЕД/ЛИЛИЯ Pure Body Wash (Honey & White Lily), 100 мл",8802929004952,NATURIA,,80,,,,,,,active
NPSS001,"나뚜리아  크리미 오일 솔트 스크럽 250g  밀크미","NATURIA  CREAMY OIL SALT SCRUB 250g MILK ME","[NATURIA] Скраб для тела МОЛОЧНЫЙ Creamy Oil Salt Scrub Milk Me, 250 гр",8802929005676,NATURIA,,40,,,,,,,active
NPSS002,"나뚜리아  크리미 오일 솔트 스크럽 250g  쏘바닐라","NATURIA  CREAMY OIL SALT SCRUB 250g SO VANILLA","[NATURIA] Скраб для тела ВАНИЛЬ Creamy Oil Salt Scrub So Vanilla, 250 гр",8802929005683,NATURIA,,40,,,,,,,active
NPSS003,"나뚜리아  크리미 오일 솔트 스크럽 250g  초코라떼","NATURIA  CREAMY OIL SALT SCRUB 250g CHOCO LATTE","[NATURIA] Скраб для тела ШОКОЛАД Creamy Oil Salt Scrub Choco Latte, 250 гр",8802929005690,NATURIA,,40,,,,,,,active
NPSS004,"나뚜리아  크리미 오일 솔트 스크럽 250g  그린티","NATURIA  CREAMY OIL SALT SCRUB 250g GREEN TEA","[NATURIA] Скраб для тела ЗЕЛЕНЫЙ ЧАЙ Creamy Oil Salt Scrub Green Tea, 250 гр",8802929005706,NATURIA,,40,,,,,,,active
NPSS005,"나뚜리아  크리미 오일 솔트 스크럽 250g  무화과","NATURIA  CREAMY OIL SALT SCRUB 250g FIG PULP",,8802929006390,NATURIA,,40,,,,,,,active
PDBC001,"페디슨 데오드 바디클렌저","PEDISON DEO DE Body Cleanser","[Pedison] Гель для душа ЛИМОН/МЯТА Deo De Body Cleanser, 750 мл",8802929000671,PEDISON,,20,20.00,16.50,17.50,0.031100,,3401.30-0000,active
PDBC002,"페디슨 데오드 바디 클렌져 패션 프루츠 750ml","PEDISON DEO DE Body Cleanser Passion Fruits","[Pedison] Гель для душа ФРУКТЫ DEO DE Body Cleanser Passion Fruits, 750 мл",8802929007434,PEDISON,,20,20.00,16.50,17.50,0.031100,,3401.30-0000,active
PDBCT01,"페디슨 데오드 바디클렌저 100ml","PEDISON DEO DE Body Cleanser 100ml","[Pedison] Гель для душа ЛИМОН/МЯТА Deo De Body Cleanser, 100 мл",8802929004907,PEDISON,,80,80.00,,,,,3401.30-0000,active
PDHS001,"페디슨 인스티튜트 보떼 아르간&퍼퓸 헤어세럼 130ml_ 로맨틱","PEDISON INSTITUT BEAUTE ARGAN PERFUME HAIR OIL SERUM 130ml_ROMANTIC","[Pedison] Парфюмированная сыворотка для волос с аргановым маслом INSTITUT BEAUTE ARGAN PERFUME HAIR OIL SERUM_ROMANTIC, 130 мл",8802929883724,PEDISON,,70,70.00,12.20,13.20,0.033660,,3305.90-9000,active
PDHS002,"페디슨 인스티튜트 보떼 아르간&퍼퓸 헤어세럼 130ml_ 소프트","PEDISON INSTITUT BEAUTE ARGAN PERFUME HAIR OIL SERUM 130ml_SOFT","[Pedison] Парфюмированная сыворотка для волос с аргановым маслом INSTITUT BEAUTE ARGAN PERFUME HAIR OIL SERUM, 130 мл",8802929883731,PEDISON,,70,70.00,12.20,13.20,0.033660,,3305.90-9000,active
PDHS003,"페디슨 인스티튜트 보떼 아르간&퍼퓸 헤어세럼 130ml_ 블루밍","PEDISON INSTITUT BEAUTE ARGAN PERFUME HAIR OIL SERUM 130ml_BLOOMING","[Pedison] Парфюмированная сыворотка для волос с аргановым маслом INSTITUT BEAUTE ARGAN PERFUME HAIR OIL SERUM BLOOMING, 130 мл",8802929883748,PEDISON,,70,70.00,12.20,13.20,0.033660,,3305.90-9000,active
PDHS004,"페디슨 인스티튜트 보떼 아르간&퍼퓸 헤어세럼 130ml_ 러브","PEDISON INSTITUT BEAUTE ARGAN PERFUME HAIR OIL SERUM 130ml_LOVE","[Pedison] Парфюмированная сыворотка для волос с аргановым маслом INSTITUT BEAUTE ARGAN PERFUME HAIR OIL SERUM_LOVE, 130 мл",8802929001449,PEDISON,,70,70.00,12.20,13.20,0.033660,,3305.90-9000,active
PDHS005,"페디슨 인스티튜트 보떼 아르간&퍼퓸 헤어세럼 130ml_ 프레쉬","PEDISON INSTITUT BEAUTE ARGAN PERFUME HAIR OIL SERUM 130ml_FRESH","[Pedison] Парфюмированная сыворотка для волос с аргановым маслом INSTITUT BEAUTE ARGAN PERFUME HAIR OIL SERUM_FRESH, 130 мл",8802929001456,PEDISON,,70,70.00,12.20,13.20,0.033660,,3305.90-9000,active
PDIR000,"페디슨 메터니티 퓨어 페미닌 클렌저 200g_밸런스 케어","PEDISON Maternity Pure Feminine Cleanser 200g_Balance Care",,8802929996028,PEDISON,,70,70.00,18.40,19.40,0.037870,,3307.90-9000,active
PDIR002,"페디슨 메터니티 퓨어 페미닌 클렌저 200g_플로랄 자무","PEDISON Maternity Pure Feminine Cleanser 200g_Floral Jamu",,8802929881706,PEDISON,,70,70.00,18.40,19.40,0.037870,,3307.90-9000,active
PDIR004,"페디슨 메터니티 퓨어 페미닌 클렌저 200g_오리엔탈 허브","PEDISON Maternity Pure Feminine Cleanser 200g_Oriental Herb",,8802929882734,PEDISON,,70,70.00,18.40,19.40,0.037870,,3307.90-9000,active
PDIR006,"페디슨 메터니티 퓨어 페미닌 클렌저 200g_알로에&콜라겐","PEDISON Maternity Pure Feminine Cleanser 200g_Aloe & Collagen",,8802929001678,PEDISON,,70,70.00,18.40,19.40,0.037870,,3307.90-9000,active
PDIR008,"페디슨 메터니티 퓨어 페미닌 클렌저 200g_허니 프로폴리스","PEDISON Maternity Pure Feminine Cleanser 200g_Honey Propolis",,8802929001692,PEDISON,,70,70.00,18.40,19.40,0.037870,,3307.90-9000,active
PDIR011,"페디슨 락토 플로라 릴리프 페미닌 클렌저 200g","PEDISON Lacto Flora Relief Feminine Cleanser 200g",,8802929009537,PEDISON,,70,70.00,18.40,19.40,0.037870,,3307.90-9000,active
PDIR012,"페디슨 락토 그린 리프레쉬 페미닌 클렌저 200g","PEDISON Lacto Green Refresh Feminine Cleanser 200g",,8802929009520,PEDISON,,70,70.00,18.40,19.40,0.037870,,3307.90-9000,active
PDRS001,"페디슨 인스티튜트 보떼 한방 뿌리 케어 헤어 컨디셔너(Hair Conditioner) 750 ml","Pedison Institut-beaute Oriental Root Care Conditioner","[Pedison] Кондиционер для волос ТРАВЫ Institut-beaute Oriental Root Care Conditioner, 750 мл",8802929000053,PEDISON,,20,20.00,16.50,17.50,0.031100,,3305.90-1000,active
PDRS003,"페디슨 인스티튜트보떼 프로폴리스 헤어트리트먼트(Propolis LPP treatment) 2L","Pedison Institut-Beaute Propolis LPP Treatment","[Pedison] Маска для волос ПРОПОЛИС Institut-Beaute Propolis LPP Treatment, 2000 мл",8802929001654,PEDISON,,6,6.00,13.00,14.00,0.027800,,3305.90-1000,active
PDRS004,"페디슨 인스티튜트 보떼 망고 리치 단백질 헤어 트리트먼트 2L","PEDISON Institut-Beaute Mango Rich LPP Treatment","[Pedison] Маска для волос МАНГО Institut-Beaute Mango Rich LPP Treatment, 2000 мл",8802929002187,PEDISON,,6,6.00,13.00,14.00,0.027800,,3305.90-1000,active
PDRS006,"페디슨 인스티튜트 보떼 아로니아 컬러 프로텍션 헤어 트리트먼트 2L","PEDISON Institute-beaut Aronia Color Protection Treatment","[Pedison] Маска для волос АРОНИЯ Institute-beaut Aronia Color Protection Treatment, 2000 мл",8802929002842,PEDISON,,6,6.00,13.00,14.00,0.027800,,3305.90-1000,active
PDRSM03,"페디슨 인스티튜트보떼 프로폴리스 헤어트리트먼트(Propolis LPP treatment) 500ml","Pedison Institut-Beaute Propolis LPP Treatment 500ml","[Pedison] Маска для волос ПРОПОЛИС Institut-Beaute Propolis LPP Treatment, 500 мл",8802929004563,PEDISON,,20,20.00,11.00,12.00,0.028310,,3305.90-1000,active
PDRSM04,"페디슨 인스티튜트 보떼 망고 리치 단백질 헤어 트리트먼트 500ml","PEDISON Institut-Beaute Mango Rich LPP Treatment 500ml","[Pedison] Маска для волос МАНГО Institut-Beaute Mango Rich LPP Treatment, 500 мл",8802929004754,PEDISON,,20,20.00,11.00,12.00,0.028310,,3305.90-1000,active
PDRSM06,"페디슨 인스티튜트 보떼 아로니아 컬러 프로텍션 헤어 트리트먼트 500ml","PEDISON Institute-beaut Aronia Color Protection Treatment 500ml","[Pedison] Маска для волос АРОНИЯ Institute-beaut Aronia Color Protection Treatment, 500 мл",8802929004815,PEDISON,,20,20.00,11.00,12.00,0.028310,,3305.90-1000,active
PDRST03,"페디슨 인스티튜트보떼 프로폴리스 헤어트리트먼트 100ml","Pedison Institut-Beaute Propolis LPP Treatment 100ml","[Pedison] Маска для волос ПРОПОЛИС Institut-Beaute Propolis LPP Treatment, 100 мл",8802929004808,PEDISON,,80,80.00,9.50,10.50,0.035900,,3305.90-1000,active
PDRST04,"페디슨 인스티튜트 보떼 망고 리치 단백질 헤어 트리트먼트 100ml","PEDISON Institut-Beaute Mango Rich LPP Treatment 100ml","[Pedison] Маска для волос МАНГО Institut-Beaute Mango Rich LPP Treatment, 100 мл",8802929004884,PEDISON,,80,80.00,9.50,10.50,0.035900,,3305.90-1000,active
PDRST06,"페디슨 인스티튜트 보떼 아로니아 컬러 프로텍션 헤어 트리트먼트 100ml","PEDISON Institute-beaut Aronia Color Protection Treatment 100ml","[Pedison] Маска для волос АРОНИЯ Institute-beaut Aronia Color Protection Treatment, 100 мл",8802929004877,PEDISON,,80,80.00,9.50,10.50,0.035900,,3305.90-1000,active
PDSP003,"페디슨 인스티튜트 보떼 한방 뿌리 케어 헤어샴푸(Hair Shampoo) 750 ml","Pedison Institut-beaute Oriental Root Care Shampoo","[Pedison] Шампунь для волос ТРАВЫ Institut-beaute Oriental Root Care Shampoo, 750 мл",8802929000046,PEDISON,,20,20.00,16.80,17.80,0.031100,,3305.10-0000,active
PDSP005,"페디슨 인스티튜트보떼 프로폴리스 헤어샴푸(Propolis LPP shampoo) 2L","Pedison Institut-Beaute Propolis Protein Shampoo","[Pedison] Шампунь для волос ПРОПОЛИС Institut-Beaute Propolis Protein Shampoo, 2000 мл",8802929001647,PEDISON,,6,6.00,13.00,14.00,0.027800,,3305.10-0000,active
PDSP006,"페디슨 인스티튜트 보떼 망고 리치 단백질 헤어 샴푸 2L","PEDISON Institute-Beaute Mango Rich Protein Hair Shampoo","[Pedison] Шампунь для волос МАНГО Institute-Beaute Mango Rich Protein Hair Shampoo, 2000 мл",8802929002170,PEDISON,,6,6.00,13.00,14.00,0.027800,,3305.10-0000,active
PDSP009,"페디슨 인스티튜트 보떼 아로니아 컬러 프로텍션 헤어 샴푸 2L","PEDISON Institute-beaut Aronia Color Protection Shampoo","[Pedison] Шампунь для волос АРОНИЯ Institute-beaut Aronia Color Protection Shampoo, 2000 мл",8802929002835,PEDISON,,6,6.00,13.00,14.00,0.027800,,3305.10-0000,active
PDSPM05,"페디슨 인스티튜트보떼 프로폴리스 헤어샴푸(Propolis LPP shampoo) 500ml","Pedison Institut-Beaute Propolis Protein Shampoo 500ml","[Pedison] Шампунь для волос ПРОПОЛИС Institut-Beaute Propolis Protein Shampoo, 500 мл",8802929004556,PEDISON,,20,20.00,11.00,12.00,0.028310,,3305.10-0000,active
PDSPM06,"페디슨 인스티튜트 보떼 망고 리치 단백질 헤어 샴푸 500ml","PEDISON Institute-Beaute Mango Rich Protein Hair Shampoo 500ml","[Pedison] Шампунь для волос МАНГО Institute-Beaute Mango Rich Protein Hair Shampoo, 500 мл",8802929004747,PEDISON,,20,20.00,11.00,12.00,0.028310,,3305.10-0000,active
PDSPM09,"페디슨 인스티튜트 보떼 아로니아 컬러 프로텍션 헤어 샴푸 500ml","PEDISON Institute-beaut Aronia Color Protection Shampoo 500ml","[Pedison] Шампунь для волос АРОНИЯ Institute-beaute Aronia Color Protection Shampoo, 500 мл",8802929004761,PEDISON,,20,20.00,11.00,12.00,0.028310,,3305.10-0000,active
PDSPT05,"페디슨 인스티튜트보떼 프로폴리스 헤어샴푸 100ml","Pedison Institut-Beaute Propolis Protein Shampoo 100ml","[Pedison] Шампунь для волос ПРОПОЛИС Institut-Beaute Propolis Protein Shampoo, 100 мл",8802929004792,PEDISON,,80,80.00,9.50,10.50,0.035900,,3305.10-0000,active
PDSPT06,"페디슨 인스티튜트 보떼 망고 리치 단백질 헤어 샴푸 100ml","PEDISON Institute-Beaute Mango Rich Protein Hair Shampoo 100ml","[Pedison] Шампунь для волос МАНГО Institute-Beaute Mango Rich Protein Hair Shampoo, 100 мл",8802929004853,PEDISON,,80,80.00,9.50,10.50,0.035900,,3305.10-0000,active
PDSPT09,"페디슨 인스티튜트 보떼 아로니아 컬러 프로텍션 헤어 샴푸 100ml","PEDISON Institute-beaut Aronia Color Protection Shampoo 100ml","[Pedison] Шампунь для волос АРОНИЯ Institute-beaute Aronia Color Protection Shampoo, 100 мл",8802929004839,PEDISON,,80,80.00,9.50,10.50,0.035900,,3305.10-0000,active
PTBC002,"위드미 판테스틱 더마 아크네 클렌져 500ml","WITHME Panthestic Derma Acne Cleanser",,8802929003559,PANTHESTIC,,30,30.00,16.90,17.90,0.034320,,3401.30-0000,active
PTBL001,"위드미 판테스틱 더마 시카 AC로션 500ml","WITHME Panthestic Derma Cica AC Lotion",,8802929007991,PANTHESTIC,,28,,,,,,,active
PTEF001,"판테스틱 원더필 하이드라 뮤신 이펙터 35ml","PANTHESTIC WONDERFILL HYDRA MUCIN EFFECTOR 35ml",,8802929006239,PANTHESTIC,,72,,,,,,,active
PTEF002,"판테스틱 원더필 써마필 이펙터 35ml","PANTHESTIC WONDERFILL THERMAPILL EFFECTOR 35ml",,8802929006253,PANTHESTIC,,72,,,,,,,active
PTEF003,"판테스틱 원더필 클리어링 이펙터 35ml","PANTHESTIC WONDERFILL CLEARING EFFECTOR 35ml",,8802929006246,PANTHESTIC,,72,,,,,,,active
PTFC001,"판테스틱 더마 시카 아크네 클렌징 폼 140ml","PANTHESTIC DERMA CICA ACNE CLEANSING FOAM",,8802929005959,PANTHESTIC,,56,56.00,9.00,10.00,0.033660,,3401.30-0000,active
PTPW001,"판테스틱 더마 시카 파우더 7g","PANTHESTIC DERMA CICA POWDER",,8802929005911,PANTHESTIC,,187,,,,,,,active
PTPW002,"판테스틱 더마 비타 파우더 7g","PANTHESTIC DERMA VITA POWDER",,8802929005928,PANTHESTIC,,187,,,,,,,active
PVMBA0010,"밸르모나 얼쓰 리페어 본딩 앰플 15ml","VALMONA Earth Repair Bonding Ampoule 15ml","[VALMONA] Сыворотка для волос ВОССТАНОВЛЕНИЕ Earth Repair Bonding Ampoule, 15 мл",8802929006109,VALMONA,,100,,,,,,,active
PVMSS0010,"밸르모나 얼쓰 테라피 스칼프 스켈러 15ml","VALMONA Earth Therapy Scalp Scaler 15ml","[VALMONA] Сыворотка для кожи головы ОЧИЩАЮЩАЯ Earth Therapy Scalp Scaler, 15 мл",8802929006093,VALMONA,,600,,,,,,,active
RABD2T1,"로즈마인 아로마 리 고요 바디 세트 (2종) [워시300ml+로션300ml]","Rosemine Aroma Re: Goyo Body Set",,8802929010564,ROSEMINE,,14,14.00,10.90,11.90,0.033660,,3304.99-1000,active
RMHC001,"로즈마인 퍼퓸드 핸드크림 가든 로즈","Rosemine Perfumed Hand Cream - Garden Rose",,8802929997438,ROSEMINE,,240,240.00,16.80,17.80,0.040390,,3304.99-1000,active
RMHC002,"로즈마인 퍼퓸드 핸드크림 패션 프룻","Rosemine Perfumed Hand Cream - Passion Fruits",,8802929997445,ROSEMINE,,240,240.00,16.80,17.80,0.040390,,3304.99-1000,active
RMHC003,"로즈마인 퍼퓸드 핸드크림 쁘띠 베이비","Rosemine Perfumed Hand Cream - Petit Baby",,8802929997452,ROSEMINE,,240,240.00,16.80,17.80,0.040390,,3304.99-1000,active
RMHC007,"로즈마인 퍼퓸드 핸드크림 헤스페리데스","Rosemine Perfumed Hand Cream - Hesperides",,8802929999203,ROSEMINE,,240,240.00,16.80,17.80,0.040390,,3304.99-1000,active
RMHC008,"로즈마인 퍼퓸드 핸드크림 나나즈 릴리","Rosemine Perfumed Hand Cream - Nana's Lily",,8802929999210,ROSEMINE,,240,240.00,16.80,17.80,0.040390,,3304.99-1000,active
RMHC015,"로즈마인 퍼퓸드 핸드크림- 모링가","Rosemine Perfumed Hand Cream - Moringa",,8802929883151,ROSEMINE,,240,240.00,16.80,17.80,0.040390,,3304.99-1000,active
RMHC016,"로즈마인 퍼퓸드 핸드크림- 머스크앤머스크2","Rosemine Perfumed Hand Cream - Musk & Musk Ⅱ",,8802929883168,ROSEMINE,,240,240.00,16.80,17.80,0.040390,,3304.99-1000,active
RMHC017,"로즈마인 퍼퓸드 핸드크림- 클래식","Rosemine Perfumed Hand Cream - Classic",,8802929883175,ROSEMINE,,240,240.00,16.80,17.80,0.040390,,3304.99-1000,active
RMHC018,"로즈마인 퍼퓸드 핸드크림- 오, 프레쉬","Rosemine Perfumed Hand Cream - Oh, Fresh",,8802929883182,ROSEMINE,,240,240.00,16.80,17.80,0.040390,,3304.99-1000,active
RMHC019,"로즈마인 퍼퓸드 핸드크림- 라비에","Rosemine Perfumed Hand Cream - Lavie",,8802929883199,ROSEMINE,,240,240.00,16.80,17.80,0.040390,,3304.99-1000,active
